Polska nazwa,Angielska nazwa,Interakcje,Strona,Substancja aktywna,Wskazania,Działanie
Abakawir,Abacavir,"Metabolizm abakawiru ulega zmianie w czasie jednoczesnego przyjmowania alkoholu (AUC substancji wzrasta o około 41%). Jednakże obserwacje te nie zostały uznane za kliniczne istotne. Abakawir natomiast nie ma wpływu na metabolizm alkoholu.
W kontrolowanych badaniach klinicznych niezbyt często występowały nieprawidłowe wyniki badań laboratoryjnych. Nie wykazano różnić w częstości ich występowania pomiędzy grupą leczoną abakawirem, a grupą kontrolną. 
",https://www.doz.pl//leki/w1-Abakawir,"abakawir, siarczan abakawiru",Abakawir jest lekiem przeciwwirusowym. Substancja stosowana jest w skojarzonej terapii przeciwretrowirusowej w leczeniu zakażeń ludzkim wirusem upośledzenia odporności (HIV).,przeciwwirusowe
Abatacept,Abatacept,"Nie należy prowadzić pojazdów mechanicznych i obsługiwać maszyn w przypadku wystąpienia działań niepożądanych takich jak zawroty głowy, utrudnione widzenie czy też mniejsza ostrość widzenia w trakcie stosowania abataceptu.
Nie zalecane jest podawanie żywej szczepionki w trakcie oraz po leczeniu abataceptem przez okres 3 miesięcy od zakończenia leczenia lekiem. Jest to związane ze potencjalnie mniejszą skutecznością odpowiedzi immunologicznej zastosowanej szczepionki.
",https://www.doz.pl//leki/w2-Abatacept,"Wskazaniem do stosowania abataceptu jest leczenie umiarkowanego lub ciężkiego czynnego reumatoidalnego zapalenia stawów. Stosowany jest u osób, u których wykazano niezadowalającą odpowiedź na leczenie innymi lekami przeciwreumatycznymi modyfikującymi przebieg choroby m.in. metotreksatem lub innymi inhibitorami czynnika TNF. Stosowany jest także w reumatoidalnym zapaleniu stawów o wysokim czynnym i postępującym charakterze, u pacjentów u których nie włączono jeszcze do leczenia metotreksat.",immunosupresyjne (zmniejsza odporność)
Abcyksymab,Abciximab,"Abcyksymab ma nieistotny wpływ na zdolność prowadzenia pojazdów oraz obsługę maszyn. 
",https://www.doz.pl//leki/w3-Abcyksymab,abcyksymab,"Abcyksymab stosowany jest pomocniczo z heparyną oraz kwasem acetylosalicylowym podczas zabiegów przezskórnych naczyń wieńcowych (angioplastyka balonowa, aterektomia, implantacja stentu) oraz w terapii niestabilnej choroby niedokrwiennej serca. ",przeciwzakrzepowe (antykoagulacyjne)
Abirateron,Abiraterone,"Zaobserwowano, że jedzenie znacząco zwiększa wchłanianie substancji czynnej. Ze względu na to, że nie ma danych klinicznych dotyczących bezpieczeństwa stosowania abirateronu z pożywieniem, łączne stosowanie jest przeciwwskazane.
Łączne stosowanie abirateronu z dziurawcem zwyczajnym – silnym induktorem CYP3A4 – może skutkować zmniejszeniem średniego AUC substancji czynnej w osoczu nawet o połowę.
",https://www.doz.pl//leki/w4-Abirateron,abirateron,"Abirateron jest stosowany w połączeniu z prednizolonem lub prednizonem w leczeniu raka gruczołu krokowego, opornego na kastrację. Substancja czynna stosowana jest u dorosłych mężczyzn, u których występują przerzuty, a mimo chemioterapii zawierającej docetaksel, choroba postępuje. Abirateron wskazany jest również u pacjentów, u których zastosowanie chemioterapii nie jest jeszcze wskazane, a wykorzystanie terapii supresji androgenowej nie przyniosło oczekiwanych rezultatów. ","przeciwandrogenne (antyandrogenowe) (hamuje działanie androgenów), przeciwnowotworowe (cytostatyczne, cytotoksyczne)"
Acebutolol,Acebutolol,"Acebutolol nie ma znanych interakcji z pożywieniem, a nawet zalecane jest jego przyjmowanie w trakcie posiłku.
Stosując acebutolol powinno sie zachować ostrożnośc przy podawaniu środków znieczulających (eter, cyklopropan i trichloroetylen),które wywołują depresję mięśnia sercowego.
",https://www.doz.pl//leki/w5-Acebutolol,acebutolol,"Acebutolol jest stosowany w monoterapii i terapii skojarzonej w nadciśnieniu tętniczym. Podawany jest także pacjentom z chorobą wieńcową, a także przy przewlekłym leczeniu nadkomorowych i komorowych zaburzeń rytmu serca.","chronotropowe ujemne (-) (zmniejszenie częstości pracy serca), dromotropowe ujemne (-) (zmniejsza szybkość przewodzenia impulsów), inotropowe ujemne (-) (zmniejsza siłę skurczu), przeciwarytmiczne, przeciwnadciśnieniowe (hipotensyjne)"
Aceklofenak,Aceclofenac,"NLPZ nie należy łączyć z alkoholem z powodu niebezpieczeństwa uszkodzenia błony śluzowej żołądka .
",https://www.doz.pl//leki/w6-Aceklofenak,aceklofenak,Aceklofenak to substancja o działaniu przeciwbólowym i przeciwzapalnym. Należy do grupy leków nazywanych niesteroidowymi lekami przeciwzapalnymi (NLPZ). ,"przeciwbólowe (bez opioidów), przeciwzapalne"
Acemetacyna,Acemetacin,"Zalecane jest przyjmowanie acemetacyny wraz z posiłkiem.
Należy zachować szczególną ostrożność spożywając alkohol podczas stosowania acemetacyny, ze względu na zwiększone ryzyko działań niepożądanych, a w szczególności utajonych krwotoków w przewodzie pokarmowym. 
Żeń-szeń nasila działanie przeciwzakrzepowe acemetacyny, wydłuża czas krwawienia oraz zwiększa ryzyko nagłych krwotoków. 
",https://www.doz.pl//leki/w7-Acemetacyna,acemetacyna,"Acemetacyna stosowana jest w schorzeniach układu kostno-stawowego takich jak: choroba zwyrodnieniowa stawów, bóle okolicy lędźwiowo-krzyżowej, reumatoidalne zapalenie stawów (RZS), zesztywniające zapalenie stawów kręgosłupa, silne napady dny moczanowej. Acemetacynę stosuje się również w terapii bólu pooperacyjnego. ","przeciwgorączkowe, przeciwreumatyczne, przeciwzapalne"
Acenokumarol,Acenocoumarol,"Przyjmując acenokumarol należy ograniczyć produkty bogate w witaminę K, do których należą warzywa liściaste (kapusta, brokuły, sałata), a także preparaty sojowe, wątroba, czy zielona herbata. Takie połączenie może prowadzić do osłabienia działania leku.
Picie soku z żurawiny znacznie nasila działanie przeciwzakrzepowe acenokumarolu. Nie ma konkretnych badań potwierdzających ryzyko interakcji po spożyciu żurawiny w postaci kapsułek/koncentratu. Wzmocnienie efektu przeciwzakrzepowego powoduje również czosnek. Zaleca się powstrzymanie od stosowania czosnku oraz żurawiny (w każdej postaci) podczas leczenia acenokumarolem, ze względu na zagrożenie ciężkimi krwawieniami.
Alkohol może nasilać działania niepożądane acenokumarolu, dlatego należy unikać spożywania alkoholu podczas leczenia.
Substancje zawarte w dymie tytoniowym zwiększają aktywność enzymu CYP1A2, który uczestniczy w metabolizmie acenokumarolu. W związku z tym osoby, które zaprzestały palenia tytoniu mogą wymagać zmiany dawkowania leku.
",https://www.doz.pl//leki/w8-Acenokumarol,acenokumarol,"Acenokumarol to lek przeciwzakrzepowy z grupy antagonistów witaminy K, który zapobiega tworzeniu się skrzepów w naczyniach krwionośnych. Jest wykorzystywany w profilaktyce i leczeniu powikłań zakrzepowo-zatorowych. Dotyczy to zakrzepicy żył głębokich, zatorowości płucnej, leczenia zatorów tętniczych, zapobieganiu udarom niedokrwiennym wśród pacjentów ze stwierdzonym migotaniem przedsionków oraz zapobieganiu powikłaniom po wszczepieniu zastawki serca. Leczenie przeciwzakrzepowe wprowadza się również w grupie pacjentów ze skrzeplinami wewnątrzsercowymi i wadami zastawkowymi.",przeciwzakrzepowe (antykoagulacyjne)
Acetazolamid,Acetazolamide,"W trakcie leczenia acetazolamidem nie należy prowadzić pojazdów i obsługiwać maszyn, ponieważ może on powodować działania niepożądane, takie jak zawroty głowy, senność, czy dezorientacja.
Acetazolamid może wpływać na wyniki niektórych badań laboratoryjnych.
",https://www.doz.pl//leki/w9-Acetazolamid,acetazolamid,Acetazolamid jest inhibitorem anhydrazy węglanowej o działaniu moczopędnym.,"łagodzi objawy obrzęku naczynioruchowego, moczopędne (diuretyczne) (zwiększa objętość wydalanego moczu), przeciwpadaczkowe, przeciwjaskrowe (obniża ciśnienie w gałce ocznej)"
Acetylocysteina,Acetylcysteine,"Nie stwierdzono interakcji z alkoholem, jednak ze względu na ryzyko podrażnienia błony śluzowej żołądka jednoczesne stosowanie nie jest zalecane.
Acetylocysteina może zaburzać wyniki niektóry badań laboratoryjnych takich jak:
",https://www.doz.pl//leki/w10-Acetylocysteina,acetylocysteina,"Acetylocysteina jest wykorzystywana ze względu na zdolność upłynnienia zalegającej w drogach oddechowych trudnej do odkrztuszenia wydzieliny.
Lek jest stosowany pomocniczo w przebiegu zapalenia oskrzeli, przeziębienia, a także  mukowiscydozy.

Acetylocysteina jest również wykorzystywana jako odtrutka podczas zatrucia paracetamolem.","mukolityczne (zmniejsza lepkość śluzu), przeciwutleniające (antyoksydacyjne), wykrztuśne"
Acyklowir,Acyclovir,"Podczas terapii cząsteczką należy pić dużo płynów i dbać o odpowiednie nawodnienie, aby nie doprowadzić do pojawienia się zaburzeń funkcji nerek oraz innych działań niepożądanych acyklowiru.
",https://www.doz.pl//leki/w1385-Acyklowir,"acyklowir, sól sodowa acyklowiru","Acyklowir jest lekiem przeciwwirusowym. Związek stosuje się w zakażeniach wirusowych ostrych lub przewlekłych, nawrotowych, także u osób z niedoborami odporności, spowodowanych wirusem opryszczki (Herpex), który wywołuje:",przeciwwirusowe
Acytretyna,Acitretine,"Równoczesne przyjęcie pojedynczej dawki acytretyny z alkoholem skutkuje wytworzeniem nowego związku - etretynatu. Jest on silnie teratogenny i dłużej eliminuje się z organizmu, stąd kobietom w wieku rozrodczym nie wolno podawać alkoholu w żadnej postaci (napojach, jedzeniu, lekach) w trakcie kuracji jak i dwa miesiące po jej zakończeniu.
Minipigułka (zawierająca niskie dawki progesteronu) nie może być uznawana za skuteczną metodę antykoncepcyjną.
",https://www.doz.pl//leki/w12-Acytretyna,acytretyna,"Ciężkie postacie łuszczycy - erytrodermiczna, uogólniona lub miejscowa krostkowa, a także schorzenia objawiające się poważnymi zaburzeniami procesu rogowacenia skóry: wrodzona rybia łuska, łupież czerwony mieszkowy, choroba Dariera oraz takie zaburzenia rogowacenia skóry, których nie można wyleczyć innymi metodami.",przeciwłuszczycowe
Adalimumab,Adalimumab,"Brak jest badań dotyczących wpływu leczenia adalimumabem na zdolność prowadzenia pojazdów mechanicznych. Należy zachować ostrożność podczas jazdy samochodem, ponieważ lek może powodować zawroty głowy i zaburzenia widzenia.
Adalimumab zwiększa stężenie enzymów wątrobowych we krwi, a także kinazy kreatynowej (CK). Stężenie kinazy jest oznaczane przy podejrzeniu zawału mięśnia sercowego czy przy pojawiających się bólach mięśniowych i osłabieniu mięśni.
",https://www.doz.pl//leki/w13-Adalimumab,adalimumab,"Adalimumab to przeciwciało monoklonalne stosowane w postaci wstrzyknięć podskórnych w terapii chorób układu ruchu takich jak reumatoidalne zapalenie stawów, młodzieńcze idiopatyczne zapalenie stawów, w aktywnej postaci łuszczycowego zapalenia stawów oraz zesztywniającego zapalenia stawów kręgosłupa. Adalimumab podaje się pacjentom cierpiącym na chorobę Leśniowskiego-Crohna oraz wrzodziejące zapalenie jelita grubego. Pozostałymi wskazaniami do stosowania adalimumabu są łuszczyca plackowata,  trądzik odwrócony (hidradenitis suppurativa, HS),  panuveitis   (stan zapalny naczyniówki oraz innych struktur wewnętrznych gałki ocznej). Pozarejestracyjnie (leczenie off-label) adalimumab stosowany jest w terapii piodermii zgorzelinowej. ","immunosupresyjne (zmniejsza odporność), przeciwzapalne"
Adapalen,Adapalene,"Nie należy stosować adapalenu u kobiet w ciąży oraz u kobiet planujących potomstwo. Badania na zwierzętach wykazały, że duże dawki adapalenu stosowanego doustnie wywierają toksyczny wpływ na płód. Dane dotyczące miejscowego stosowania substancji u kobiet w ciąży są ograniczone.
",https://www.doz.pl//leki/w14-Adapalen,adapalen,"Adapalen posiada działanie podobne do retinoidów. Normalizuje procesy rogowacenia i różnicowania naskórka, działa przeciwzapalnie oraz zapobiega tworzeniu się zaskórników.","keratolityczne (złuszczające), przeciwtrądzikowe"
Adefowir,Adefovir,"Posiłek bogaty w tłuszcz wydłuża czas potrzebny do osiągnięcia maksymalnego stężenia adefowiru we krwi średnio o 120 minut. 
Adefowir zmniejsza tempo eliminacji olejku goździkowego i eukaliptusowego, co może skutkować zwiększonym stężeniem olejków w surowicy krwi.
",https://www.doz.pl//leki/w15-Adefowir,"adefowir, dipiwoksyl adefowiru","Adefowir stosuje się w terapii wirusowego zapalenia wątroby typu B. Lek jest ordynowany osobom dorosłym w przypadku wyrównanej czynności wątroby bądź w terapii skojarzonej z innym lekiem przy niewyrównanej czynności wątroby. Do rozpoczęcia terapii lekiem konieczne jest stwierdzenie czynnej replikacji wirusa  Hepatitis B Virus, stan zapalny i zmiany zwłóknieniowe wątroby oraz zwiększenie stężenia aminotransferazy alaninowej w surowicy krwi. Adefowir bywa łączony z lamiwudyną, co daje lepsze efekty terapeutyczne wśród części pacjentów. ",przeciwwirusowe
Adenozyna,Adenosine,"Nie należy spożywać produktów zawierających ksantyny, jak np. herbata, kawa, czekolada, napoje energetyczne typu cola, na minimum 12 godzin przed podaniem adenozyny.
",https://www.doz.pl//leki/w16-Adenozyna,adenozyna,"Adenozyna podawana jest w przypadku konieczności szybkiego przerwania nawrotnego częstoskurczu węzłowego i przedsionkowo-komorowego, w celu szybkiego przywrócenia prawidłowego rytmu zatokowego w napadowym częstoskurczu nadkomorowym lub zespole Wolffa-Parkinsona-White’a (zaburzeniu pracy serca polegającym na występowaniu dodatkowej drogi przewodzenia między przedsionkami a komorami) oraz w diagnostyce różnicującej tachyarytmie u osób dorosłych i leczeniu ostrej porfirii przerywanej.","diagnostyczne, przeciwarytmiczne"
Adrenalina,Adrenaline,"Alkohol nasila działanie adrenaliny.
",https://www.doz.pl//leki/w17-Adrenalina,"adrenalina, chlorowodorek epinefryny, epinefryna, winian adrenaliny","Adrenalina jest stosowana w sytuacji zatrzymania krążenia w celu przywrócenia bicia serca i czynności oddechowej, we wstrząsie kardiogennym lub anafilaktycznym i w innych ostrych reakcjach alergicznych wywołanych np. ukąszeniem owadów, pokarmem, lekami itp. Innym wskazaniem do stosowania adrenaliny jest ciężka bradykardia i przerwanie skurczu oskrzeli w napadzie astmy oskrzelowej.","chronotropowe dodatnie (+) (zwiększenie częstości pracy serca), inotropowe dodatnie (+) (zwiększa siłę skurczu), podwyższa ciśnienie krwi, poprawia krążenie wieńcowe, rozszerza oskrzela (rozkurcza mięśnie gładkie oskrzeli)"
Afamelanotyd,Afamelanotide,"U pacjentów zażywających leki zmniejszające krzepliwość krwi (warfaryna, antagonisty witaminy K, kwas acetylosalicylowy, niesteroidowe leki przeciwzapalne), może pojawić się nasilone zasinienie lub krwawienie w miejscu podania implantu z afamelanotydem.
",https://www.doz.pl//leki/w18-Afamelanotyd,afamelanotyd,Afamelanotyd wskazany jest w zapobieganiu nadwrażliwości na światło słoneczne u dorosłych pacjentów cierpiących na protoporfirię erytropoetyczną.,działanie ochronne przed promieniowaniem UV (ogólne)
Afatynib,Afatinib,"Przyjęcie leku z posiłkiem (zwłaszcza bogatotłuszczowym) wiąże się ze zmniejszeniem ekspozycji na afatynib, co wpływa na obniżenie skuteczności leczenia.
Ziele dziurawca (Hypericum perforatum) może zmniejszyć ekspozycję na afatynib, a tym samym skuteczność działania przeciwnowotworowego.
",https://www.doz.pl//leki/w19-Afatynib,afatynib,Afatynib jest stosowany w leczeniu pacjentów z miejscowo zaawansowanym lub z przerzutami niedrobnokomórkowym rakiem płuc z mutacjami EGFR (jeżeli wcześniej pacjent nie był poddany leczeniu inhbitorami kinazy tyrozynowej receptora naskórkowego czynnika wzrostu) oraz w niedrobnokomórkowym raku płuc o histologii płaskonabłonkowej (jeżeli doszło do pogorszenia stanu pacjenta w trakcie lub po zakończeniu stosowania związków platyny).,"przeciwnowotworowe (cytostatyczne, cytotoksyczne)"
Agalzydaza,alfa,"Agalzydaza alfa nie wpływa na zdolność prowadzenia pojazdów i obsługi maszyn. 
",https://www.doz.pl//leki/w1295-Agalzydaza_alfa,agalzydaza alfa,Agalzydaza alfa jest enzymem wykorzystywanym w leczeniu choroby Fabry'ego. Przyczyną schorzenia jest niedobór α–galaktozydazy – naturalnie występującego w organizmie enzymu rozkładającego glikosfingolipidy powstające w różnych komórkach ustroju. ,zmniejszenie stężenia globotriaozyloceramidu w komórkach organizmu
Agalzydaza,beta,"Podczas stosowania agalzydazy beta mogą wystąpić zawroty głowy, senność lub omdlenia. 
",https://www.doz.pl//leki/w1296-Agalzydaza_beta,agalzydaza alfa,Agalzydaza beta jest postacią ludzkiej α-galaktozydazy A. Jest wytwarzana metodą rekombinacji DNA z użyciem hodowli komórek jajnika chomika chińskiego z zachowaniem identycznej sekwencji zarówno aminokwasów jak i nukleotydów co w naturalnej postaci. ,korekcja nieprawidłowych szlaków metabolicznych / enzymatycznych
Agomelatyna,Agomelatine,"Posiłek bogatotłuszczowy, może mieć wpływ na szybkość wchłaniania oraz dostępność biologiczną agomelatyny.
Nie zalecane jest, stosowanie agomelatyny u pacjentów z chorobami wywołanymi nadużywaniem alkoholu oraz spożywających znaczne ilości alkoholu, ze względu na ryzyko toksyczności i trwałego uszkodzenia wątroby.
Preparaty z agomelatyną zawierają laktozę. Zatem takie leki nie powinny być podawane pacjentom cierpiącym na dziedziczną nietolerancję galaktozy lub niedobór enzymu laktazy oraz pacjentom z zespołem złego wchłaniania glukozy-galaktozy.
",https://www.doz.pl//leki/w22-Agomelatyna,agomelatyna,"Agomelatyna jest wskazana do leczenia dużych epizodów depresyjnych u osób dorosłych. Jest to skuteczny leki przeciwdepresyjny o szybkim początku działania, a jego skuteczność terapeutyczna utrzymuje się przez dłuższy czas.","przeciwdepresyjne (antydepresyjne, tymoleptyczne)"
Akamprozat,(Acetylohomotaurynian,"Jednoczesne przyjmowanie akamprozatu i alkoholu nie ma wpływu na farmakokinetykę obu substancji.
",https://www.doz.pl//leki/w23-Akamprozat_Acetylohomotaurynian_wapnia,akamprozat,"Akamprozat jest stosowany w celu utrzymania abstynencji od alkoholu u pacjentów uzależnionych, u których jednocześnie prowadzana jest psychoterapia.",wspomaga leczenie uzależnienia od alkoholu
Akarboza,Acarbose,"Podczas stosowania akarbozy należy ograniczyć spożycie produktów spożywczych zawierających sacharozę ze względu na możliwość wystąpienia biegunek lub innych objawów niepożądanych ze strony układu pokarmowego.
Nie należy spożywać alkoholu podczas leczenia akarbozą. Alkohol spożyty w trakcie leczenia może znacząco obniżać poziom cukru we krwi i wywoływać objawy takie jak nadmierne pocenie, uczucie głodu, kołatanie serca, niepokój, zaburzenia widzenia, drżenie rąk, bóle głowy, senność i bladość.
",https://www.doz.pl//leki/w24-Akarboza,akarboza,Akarboza jest lekiem przeciwcukrzycowym.,"hamuje enzymy jelitowe trawiące węglowodany (α-glukozydazy), przeciwcukrzycowe (hipoglikemizujące; zmniejsza stężenie glukozy we krwi), zwiększa wrażliwość komórek na insulinę"
Aksytynib,Axitinib,"W trakcie terapii aksytynibem nie zaleca się spożywania grejpfrutów, gdyż może on zwiększać stężenie leku w osoczu.
",https://www.doz.pl//leki/w26-Aksytynib,aksytynib,"Wskazaniem do stosowania aksytynibu jest leczenie zaawansowanego raka komórek nerek u pacjentów dorosłych, u których nie powiodła się wcześniejsza terapia sunitynibem lub cytokiną. Badany jest też w kierunku leczenia nowotworu trzustki i tarczycy.","przeciwnowotworowe (cytostatyczne, cytotoksyczne)"
Albendazol,Albendazole,"Zastosowanie albendazolu łącznie z pokarmem o dużej zawartości tłuszczu zwiększa pięciokrotnie jego wchłanianie.
",https://www.doz.pl//leki/w1381-Albendazol,albendazol,"Albendazol to lek stosowany w przypadku zarażeniach pasożytami. Jest lekiem przeciwpasożytniczym (przeciwrobaczym). Albendazol działa na formy dorosłe pasożytów, a także ich larwy i jaja. ",przeciwpasożytnicze i przeciwrobacze
Albiglutyd,Albiglutide,"Albiglutyd podaje się niezależnie od posiłków. Ze względu na ryzyko odwodnienia na wskutek możliwych wymiotów i biegunki zaleca się przyjmowanie zwiększonej ilości płynów podczas terapii lekiem.
Alkohol wpływa na poziom glukozy we krwi. Należy unikać spożywania alkoholu zwłaszcza po wysiłku fizycznym lub na pusty żołądek ponieważ sprzyja to wystąpieniu hipoglikemii.
Dziurawiec zwyczajny zmniejsza siłę działania albiglutydu, podobnie jak roślina przęśl chińska (Ephedra sinica). Guma guar pozyskiwana z nasion Cyamopsis tetragonolobus (stosowana jako dodatek do żywności) zwiększa ryzyko hipoglikemii podczas terapii albiglutydem. Podobnie działa olej rybny.
",https://www.doz.pl//leki/w29-Albiglutyd,albiglutyd,Albiglutyd jest lekiem biologicznym powstałym przez połączenie ludzkiej albuminy z glukagonopodobnym peptydem-1 opornym na działanie dipeptydylopeptydazy. Jest zaliczany do grupy agonistów hormonu jelitowego GLP 1 (peptyd glukagonopodobny). Albiglutyd stosowany jest u dorosłych pacjentów w celu  stabilizacji poziomu glukozy we krwi w przypadku cukrzycy typu II. Może być używany w monoterapii bądź też w połączeniu z innymi lekami przeciwcukrzycowymi i insuliną. ,"przeciwcukrzycowe (hipoglikemizujące; zmniejsza stężenie glukozy we krwi), zmniejsza masę ciała (odchudzające)"
Albumina,ludzka,"Preparatów albuminy ludzkiej nie można łączyć z żywieniem pozajelitowym. Zachodzi interakcja prowadząca do wytrącania się białek. 
Preparatów albuminy ludzkiej nie można łączyć z roztworami zawierającymi alkohol. Takie połączenie może stać się przyczyną wytrącania białek. 
Przeciwwskazane jest rozcieńczanie preparatów albuminy ludzkiej wodą do wstrzykiwań. Takie połączenie grozi wystąpieniem hemolizy, czyli rozpadu krwinek czerwonych u pacjenta.
",https://www.doz.pl//leki/w30-Albumina_ludzka,albumina ludzka,"Albumina ludzka to białko surowicy krwi, stanowiące ponad 50 % wszystkich białek osocza. Głównym zadaniem albuminy ludzkiej jest utrzymywanie prawidłowego ciśnienia onkotycznego krwi oraz uczestnictwo w transporcie związków endogennych (wytwarzanych w organizmie np. hormony, enzymy) i związków egzogennych (leków, toksyn).","diagnostyczne, podwyższa ciśnienie krwi, przeciwwstrząsowe, zapobiega niedociśnieniu (hipotensji)"
Alektynib,Alectinib,"Stosowanie soku grejpfrutowego wraz z alektynibem może hamować jego metabolizm i zwiększać stężenie alektynibu we krwi.
Należy mieć na uwadze, iż sok grejpfrutowy oraz sok z gorzkich pomarańczy hamują metabolizm alektynibu. Ponadto preparaty Dziurawca zwyczajnego (Hypericum perforatum) indukują metabolizm alektynibu. Raczej nie ma to znaczenia klinicznego, ze względu na aktywność metabolitu M4, jednak zaleca się ostrożność w kwestii takich połączeń. Należy pamiętać, że nie można wykluczyć zmniejszającego wpływu alektynibu na skuteczność doustnych środków antykoncepcyjnych.
",https://www.doz.pl//leki/w1297-Alektynib,alektynib,Alektynib jest wskazany w leczeniu niedrobnokomórkowego raka płuca (NDRP) u osób dorosłych. Może on być lekiem pierwszego rzutu w zaawansowanym ALK-dodatnim NDRP lub po wcześniejszej terapii kryzotynibem.,"przeciwnowotworowe (cytostatyczne, cytotoksyczne)"
Alemtuzumab,Alemtuzumab,"Nie wolno stosować w jednej infuzji roztworu alemtuzumabu oraz innych leków.
",https://www.doz.pl//leki/w32-Alemtuzumab,alemtuzumab,"Alemtuzumab jest wskazany do stosowania u dorosłych pacjentów z aktywną rzutowo-ustępującą postacią stwardnienia rozsianego (RRMS), potwierdzoną przez objawy kliniczne lub wyniki diagnostyki obrazowej.",immunosupresyjne (zmniejsza odporność)
Alendronian,sodu,"Alendronian sodu, nie powinien być przyjmowany z pokarmami bogatymi w wapń, glin, magnez, żelazo oraz cynk. Nie jest zalecane stosowanie go z napojami zawierającymi kofeinę oraz z wodą mineralną. Wszystkie z wymienionych substancji zmniejszają wchłanianie i skuteczność alendronianu.
Podczas terapii alendronianem sodu, pacjenci są objęci całkowitym zakazem spożywania alkoholu.
Alendronian sodu wykazuje duży wpływ na metabolizm wapnia. Lekarze radzą odstawić go przed wykonaniem badań czynnościowych przytarczyc oraz oznaczeniem poziomu wapnia w surowicy krwi.
",https://www.doz.pl//leki/w33-Alendronian_sodu,"alendronian sodu, kwas alendronowy","Głównym wskazaniem do stosowania alendronianu sodu jest terapia osteoporozy u kobiet po menopauzie. Ma ona na celu zmniejszenie ryzyka złamań kręgów i szyjki kości udowej. Farmakoterapia alendroinianem sodu ma także zapobiegać osteoporozie,  wywołanej stosowaniem glikokortykosteroidów u kobiet po menopauzie, które nie otrzymują terapii estrogenowej. Alendroinian wskazany jest również do leczenia mężczyzn chorych na osteoporozę, aby zmniejszyć u nich ogólne ryzyko złamań.","hamuje osteolizę i działanie osteoklastów, zmniejsza (hamuje) resorpcję kości, zwiększa masę kostną (kości), wspomaga mineralizację kości i tkanki kostnej i zapobiega demineralizacji"
