Polska nazwa,Angielska nazwa,Interakcje,Strona,Substancja aktywna,Wskazania,Działanie
Baklofen,Baclofen,"Lek należy przyjmować z posiłkiem. 
Baklofen nasila działanie uspokajające alkoholu. Może również nasilić już występującą chorobę alkoholową. 
Możliwy dodatni wynik badania na krew utajoną w kale (częstość nieznana).
",https://www.doz.pl//leki/w107-Baklofen,baklofen,"Baklofen stosuje się do leczenia stanów spastycznych, które mogą występować w przypadku:",miorelaksujące (zmniejsza napięcie mięśni szkieletowych)
Baricytynib,Baricitinib,"Baricytynib ma wpływ na wczesny rozwój embrionalny. W badaniach prowadzonych wśród szczurów i królików potwierdzono teratogenne działanie leku (zmniejszenie masy ciała, ograniczenie wzrostu, deformacje szkieletu). Stosowanie baricytynibu w ciąży jest przeciwwskazane. Kobiety w okresie rozrodczym muszą stosować skuteczną metodę antykoncepcji podczas leczenia i przez co najmniej tydzień po zakończeniu przyjmowania leku.
",https://www.doz.pl//leki/w1375-Baricytynib,"Baricytynib jest stosowany w leczeniu umiarkowanych i ciężkich postaci reumatoidalnego zapalenia stawów, gdy terapia lekami modyfikującymi przebieg choroby jest nieskuteczna lub niemożliwa do zastosowania u danego pacjenta. Lek może być stosowany w tym wskazaniu w monoterapii lub w połączeniu z metotreksatem.
Baricytynib jest również stosowany w leczeniu atopowego zapalenia skóry o nasileniu umiarkowanym do ciężkiego, gdy osoba dorosła wymaga wprowadzenia terapii ogólnoustrojowej.","immunosupresyjne (zmniejsza odporność), przeciwreumatyczne, wspomaga leczenie atopowego zapalenie skóry (AZS)"
Bazedoksyfen,Bazedoxifene,"Jedzenie nie wpływa na działanie bazedoksyfenu.
Bazedoksyfen zwiększa stężenie globulin wiążących hormony:  kortykosteroidy (CBG), płciowe (SHBG), tyroksynę (TBG).
",https://www.doz.pl//leki/w109-Bazedoksyfen,bazedoksyfen,"Bazedoksyfen wskazany jest w leczeniu osteoporozy u kobiet po menopauzie, które należą do grupy zwiększonego ryzyka złamań.","hamuje osteolizę i działanie osteoklastów, zmniejsza (hamuje) resorpcję kości, wspomaga leczenie osteoporozy, zapobiega rozwojowi osteoporozy"
Bazyliksymab,Basiliximab,"Brak jest dowodów, żeby bazyliksymab wchodził w interakcje z pożywieniem. 
Bazyliksymab podawany jest pacjentom po przeszczepach nerek, nie jest zalecane, aby spożywali oni alkohol w trakcie takiej terapii. Chociaż brak jest danych dotyczących wzajemnej interakcji.
W badaniach klinicznych w czasie, których oceniano wzajemny wpływ na siebie leków podawanych pacjentom po przeszczepach nerek dowiedziono, że dodatek azatiopryny zmniejszał klirens bazyliksymabu o 22%, a w przypadku dodatku mykofenolanu mofetylu klirens był zmniejszony aż o 51%. Możemy zatem wnioskować, że terapia samą cyklosporyną i kortykosteroidami jest bezpieczniejsza dla pacjenta.
",https://www.doz.pl//leki/w110-Bazyliksymab,bazyliksymab,"Bazyliksymab to przeciwciało monoklonalne, wskazane do zapobiegania odrzucaniu przeszczepu po allogenicznej transplantacji nerki u osób dorosłych oraz dzieci od 1 do 17 roku życia. Jest przeznaczony do terapii skojarzonej z preparatem immunosupresyjnym, dokładniej cyklosporyną podawaną w postaci mikroemulsji oraz kortykosteroidami. Powyższy schemat, ma zastosowanie u pacjentów, z liczbą poniżej 80% reaktywnych przeciwciał. Natomiast w cięższych przypadkach wykorzystywana jest trójlekowa terapia podtrzymująca, w jej skład wchodzą: kortykosteroidy, cyklosporyna w postaci mikroemulsji oraz azatiopryna lub mykofenolan mofetylu.",immunosupresyjne (zmniejsza odporność)
Bedakilina,Bedaquiline,"Na podstawie dostępnych wyników badań stwierdzono, że bedakilina może mieć niewielki wpływ na prowadzenie pojazdów lub obsługę maszyn potencjalnie niebezpiecznych. Zgłaszano zawroty głowy, dlatego należy ocenić ryzyko ich wpływu indywidualnie na pacjenta i niebezpieczeństwo wynikające z ich obecności podczas prowadzenia pojazdów lub obsługi maszyn potencjalnie niebezpiecznych.
",https://www.doz.pl//leki/w111-Bedakilina,bedakilina,Bedalikina jest wskazana do stosowania u osób dorosłych i młodzieży (12-18 roku życia o masie ciała większej niż 30kg) jako składnik terapii skojarzonej w przypadku wielolekoopornej gruźlicy płuc w sytuacji gdy nie jest możliwe zastosowanie innego leku ze względu na oporność lub nietolerancję.,"bakteriobójcze, bakteriostatyczne, przeciwbakteryjne, przeciwgruźlicze, przeciwprątkowe"
Beklometazon,Beclomethasone,"Substancja lecznicza wywiera nieistotny wpływ na zdolność prowadzenia pojazdów i obsługę maszyn. 
Beklometazon w postaci inhalacji może wchodzić w interakcję z dymem papierosowym. 
",https://www.doz.pl//leki/w112-Beklometazon,"beklometazon, dipropionian beklometazonu","Beklometazon należy do przeciwzapalnych glikokortykosteroidów przeznaczonych do stosowania miejscowego. Lek znalazł zastosowanie w terapii schorzeń dróg oddechowych, do których zaliczamy:","przeciwastmatyczne, przeciwzapalne"
Beksaroten,Bexarotene,"Przyjmowanie beksarotenu zalecane jest podczas lub tuż po posiłku. W trakcie stosowania substancji nie jest zalecane spożywanie soku z grejpfruta, gdyż może on podnosić poziom stężenia beksarotenu w osoczu.
W przypadku pacjentów spożywających znaczne ilości alkoholu należy zgłosić ten fakt lekarzowi przed rozpoczęciem kuracji beksarotenem. Łączenie beksarotenu z alkoholem może nasilać objawy niepożądane oraz ryzyko zapalenia trzustki. 
Beksaroten zwiększa wrażliwość skóry na światło co może prowadzić do poparzeń słonecznych, wysypki, świądu oraz zaczerwienienia skóry. 
",https://www.doz.pl//leki/w113-Beksaroten,beksaroten,Beksaroten stosowany jest w terapii zmian skórnych w stadium zaawansowanym chłoniaka skórnego T-komórkowego (CTCL - ang. cutaneous t-cell lymphoma) u pacjentów po co najmniej jednym leczeniu ogólnym.,"przeciwnowotworowe (cytostatyczne, cytotoksyczne)"
Belimumab,Belimumab,"Nie badano wpływu belimumabu na zdolność prowadzenia pojazdów i obsługi urządzeń mechanicznych, jednak nie przewiduje się, by mógł on wykazywać szkodliwe działanie pod tym względem.
Dożylne roztwory belimumabu nie są zgodne z 5% roztworem glukozy i nie należy ich podawać łącznie.
",https://www.doz.pl//leki/w115-Belimumab,belimumab,"Belimumab stosowany jest jako terapia uzupełniająca u dorosłych pacjentów z aktywnym toczniem rumieniowatym układowym (SLE), z aktywnymi autoprzeciwciałami, u których pomimo stosowania standardowego leczenia występuje wysoki stopień aktywności choroby (np. z obecnością przeciwciał przeciwko dsDNA i z niskim poziomem dopełniacza).",wspomaga czynność układu odpornościowego (immunologicznego)
Bemiparyna,Bemiparin,"Bemiparyna nie wpływa na zdolność prowadzenia pojazdów i obsługę maszyn potencjalnie niebezpiecznych.
",https://www.doz.pl//leki/w116-Bemiparyna,bemiparyna sodowa,"Bemiparyna jest wskazana do stosowania w celu zapobiegania powstawaniu zakrzepów krwi w żyłach po ogólnych operacjach jamy brzusznej u pacjentów z umiarkowanym ryzykiem żylnej choroby zakrzepowo-zatorowej, w profilaktyce choroby zakrzepowo-zatorowej u pacjentów niechirurgicznych, zapobieganie krzepnięciu w obwodzie pozaustrojowym podczas hemodializy, zapobieganie powstawaniu zakrzepów krwi w żyłach po dużym zabiegu ortopedycznym u pacjentów z wysokim ryzykiem żylnej choroby zakrzepowo-zatorowej, wtórna profilaktyka żylnej choroby zakrzepowo-zatorowej; nawrót u pacjentów z zakrzepicą żył głębokich, przejściowa profilaktyka i leczenie zakrzepicy żył głębokich (DVT). ",przeciwzakrzepowe (antykoagulacyjne)
Benazepryl,Benazepril,"Ze względu na ryzyko wystąpienia hiperkaliemii należy unikać nadmiernego spożywania  produktów zawierających potas np. migdały, szpinak, daktyle, pomidory, ziemniaki i awokado. Pożywienie nieznacznie spowalnia wchłanianie benazeprylu.
Benazeprylu nie należy łączyć z alkoholem ze względu na wzrost działania hipotensyjnego substancji czynnej i działań niepożądanych alkoholu.
",https://www.doz.pl//leki/w117-Benazepryl,chlorowodorek benazeprilu,"Benazepryl jest wskazany w leczeniu nadciśnienia tętniczego,  wspomagająco w terapii zastoinowej niewydolności serca oraz postępującej, przewlekłej niewydolności nerek.","wspomaga leczenie niewydolności serca, przeciwnadciśnieniowe (hipotensyjne)"
Bencyklan,Bencyclane,"Na początku leczenia należy zachować szczególną ostrożność podczas prowadzenia pojazdów i obsługi urządzeń mechanicznych, ze względu na ryzyko występowania bólów i zawrotów głowy oraz senności.
",https://www.doz.pl//leki/w118-Bencyklan,bencyklan,Wskazany jest w leczeniu objawów miażdżycy zarostowej tętnic kończyn dolnych.,rozszerza naczynia krwionośne
Bendamustyna,Bendamustine,"Bendamustyna może wywoływać ataksję, neuropatię obwodową oraz senność. Pacjent w trakcie leczenia powinien unikać prowadzenia pojazdów i obsługiwania urządzeń mechanicznych.
",https://www.doz.pl//leki/w119-Bendamustyna,"bendamustyna, chlorowodorek bendamustyny","Bendamustyna jest stosowana w leczeniu przewlekłej białaczki limfocytowej (stadium choroby B lub C wg klasyfikacji Bineta) u pacjentów, u których nie jest wskazane stosowanie fludarabiny, w monoterapii u pacjentów z chłoniakiem nieziarniczym leczonych rytuksymabem oraz w leczeniu skojarzonym z predniozonem u pacjentów powyżej 65. roku życia ze szpiczakiem mnogim (stadium II z progresją lub stadium III wg klasyfikacji Durie-Salmona), którzy nie kwalifikują się do autologicznego przeszczepu komórek macierzystych szpiku a leczenie talidomidem lub bortezomibem jest u nich niemożliwe z powodu neuropatii.","przeciwnowotworowe (cytostatyczne, cytotoksyczne)"
Benfotiamina,Benfotiamine,"Brak danych na temat interakcji benfotiaminy z żywnością.
Spożywanie alkoholu w trakcie suplementacji benfotiaminą zmniejsza wchłanianie substancji i wywiera negatywny wpływ na zdolność do magazynowania i metabolizm tiaminy.
Konsumpcja napojów mających w składzie siarczyny (na przykład wino) w trakcie leczenia benfotiaminą nasila rozpad tiaminy i obniża skuteczność terapii.
",https://www.doz.pl//leki/w120-Benfotiamina,benfotiamina,"Benfotiamina jest stosowana w profilaktyce a także leczeniu chorób sercowo-naczyniowych, związanych z uszkodzeniem naczyń krwionośnych oraz mięśnia sercowego. Substancja znalazła zastosowanie w terapii chorób układu nerwowego, między innymi w polineuropatii będącej następstwem cukrzycy czy choroby alkoholowej. Suplementacja benfotiaminą wskazana jest u osób narażonych na niedobór witaminy B1, w tym pacjentów karmionych pozajelitowo, stosujących wysokie dawki leków moczopędnych, dializowanych, chorych na cukrzycę typu 1 i 2, osób żyjących w ciągłym stresie, czy będących na restrykcyjnej diecie.","wspomaga metabolizm komórek nerwowych, uzupełnia niedobór witaminy B1 (tiaminy)"
Benzalkoniowy,chlorek,"Mleko zmniejsza skuteczność przeciwbakteryjnego działania chlorku benzalkoniowego.
",https://www.doz.pl//leki/w121-Benzalkoniowy_chlorek,benzalkoniowy chlorek,Chlorek benzalkoniowy posiada właściwości antyseptyczne.,"przeciwbakteryjne, przeciwgrzybicze, przeciwwirusowe"
Benzokaina,(Anestezyna),"
        Działa niepożądane zostały podzielone ze względu na częstotliwość występowania u pacjentów. (Klasyfikacja MdDRA)
    
",https://www.doz.pl//leki/w1372-Benzokaina_Anestezyna,Benzokaina,Substancja miejscowo znieczulająca wykorzystywana w:,znieczulające miejscowo
Benzylopenicylina,benzatynowa,"Obecnie brak jest danych oceniających wpływ benzylopenicyliny benzatynowej na zdolność prowadzenia pojazdów i obsługę maszyn. Jednak antybiotyk może powodować zaburzenia widzenia, splątanie, senność oraz omamy, które mogą zaburzać zdolność prowadzenia pojazdów.
",https://www.doz.pl//leki/w123-Benzylopenicylina_benzatynowa,benzylopenicylina benzatynowa,"Benzylopenicylina benzatynowa jest antybiotykiem beta-laktamowym o działaniu bakteriobójczym. Lek stosowany jest w przypadku zakażeń bakteriami wrażliwymi na działanie antybiotyku. U osób dorosłych penicylina znajduje zastosowanie w leczeniu kiły oraz zakażeń górnych dróg oddechowych wywołanych przez paciorkowce, a także w profilaktyce nawrotów ostrych rzutów gorączki reumatycznej, kłębuszkowego zapalenia nerek oraz zapalenia wsierdzia. Natomiast u dzieci lek można stosować jedynie zapobiegawczo w przypadku choroby reumatycznej oraz zapalenia wsierdzia.",bakteriobójcze
Benzylopenicylina,potasowa,"Substancja czynna nie wywiera wpływu na zdolność prowadzenia pojazdów i obsługi maszyn. 
",https://www.doz.pl//leki/w124-Benzylopenicylina_potasowa,benzylopenicylina potasowa,Benzylopenicylina potasowa jest antybiotykiem beta–laktamowym.,"bakteriobójcze, bakteriostatyczne, przeciwbakteryjne"
Benzylopenicylina,prokainowa,"Substancja czynna nie powoduje objawów wpływających na zdolność prowadzenia pojazdów i obsługiwania maszyn. Jeśli jednak u pacjenta wystąpią działania niepożądane mające wpływ na zdolność koncentracji, należy zachować szczególną ostrożność w czasie wykonywania tychże czynności.
W wyniku stosowania benzylopenicyliny prokainowej, wynik testu Coombsa może być fałszywie dodatni.
",https://www.doz.pl//leki/w125-Benzylopenicylina_prokainowa,benzylopenicylina prokainowa,"Benzylopenicylina prokainowa jest stosowana w leczeniu zakażeń w stopniu od umiarkowanego do ciężkiego, które wywołane są przez bakterie wrażliwe na substancję czynną. Antybiotyk stosuje się między innymi w leczeniu chorób wywołanych przez paciorkowce (grupa A, C, G, H, L, M) oraz pneumokoki, które powodują zakażenia górnych i dolnych dróg oddechowych, zapalenia wsierdzia, szkarlatynę, czy też paciorkowcowe zakażenie skóry i tkanki podskórnej (róża). Substancja czynna ma również wskazania w leczeniu rzeżączki (wywołanej przez Neisseria gonorrhoeae), mieszanych zakażeń gardła (angina Vincenta) i różycy (wywołanej przez Erysipelothrix rhusiopathiae). Benzylopenicylina prokainowa stosowana jest także w kile nabytej lub wrodzonej (wywołanej przez Treponema pallidum), w zakażeniach narządów płciowych wywołanych przez krętki i wrzecionowce oraz w krętkowicy endemicznej, spowodowanej przez Treponema pallidum endemicum (kiła endemiczna), Treponema pallidum carateum (pinta) oraz Treponema pallidum pertenue (frambezja, malinica). Benzylopenicylina prokainowa używana jest również w połączeniu z antytoksyną, w celu zapobiegania wystąpienia błonicy oraz w leczeniu wąglika (wywołanego przez Bacillus anthracis) oraz w leczeniu gorączki szczurzej (wywołanej przez Streptobacillus minor i moniliformis).",bakteriobójcze
Beraktant,Beractant,"Po podaniu dotchawiczym beraktantu mogą wystąpić następujące działania niepożądane: krótkotrwałe zwolnienie czynności serca noworodka oraz obniżenie stężenia tlenu we krwi, rzężenie, wilgotne szmery oddechowe, zwiększone ryzyko zakażeń oraz zwiększone ryzyko wystąpienia krwawienia do płuc i mózgu oraz bezdech. 
",https://www.doz.pl//leki/w126-Beraktant,beraktant,"Beraktant znajduje zastosowanie w leczeniu oraz zapobieganiu zespołu zaburzeń oddychania u noworodków, w tym wcześniaków. "
Beta-karoten,(Prowitamina,"Może być podawany z pożywieniem, w otoczeniu tłuszczów lepiej się wchłania.
",https://www.doz.pl//leki/w127-Beta-karoten_Prowitamina_A,beta-karoten,"Beta-karoten jest barwnikiem występującym w żółtych, pomarańczowych i zielonych częściach owoców i warzyw. Znanych jest wiele karotenoidów, lecz beta-karoten jest najaktywniejszym prekursorem witaminy A.","przeciwutleniające (antyoksydacyjne), uzupełnia niedobór witaminy A"
Betahistyna,Betahistine,"Pokarm opóźnia wchłanianie betahistyny.
",https://www.doz.pl//leki/w128-Betahistyna,"betahistyna, dichlorowodorek betahistyny","Betahistyna - pochodna histaminy - to substancja stosowana w zawrotach głowy różnego pochodzenia, a także w chorobie Ménière'a (obejmuje zawroty głowy z wymiotami / nudnościami, szumy uszne, utratę słuchu postępującą). Jest stosowana w zaburzeniach równowagi, szumach usznych, zawrotach głowy pochodzenia przedsionkowego.","wspomaga leczenie zawrotów głowy, wspomaga leczenie szumów usznych, rozszerza naczynia mózgowe (poprawia krążenie mózgowe)"
Betaina,Betaine,"Nie ma doniesień na temat interakcji betainy z żywnością. Badania in vitro sugerują, że możliwa jest interakcja betainy z aminokwasami.
Nie ma doniesień na temat interakcji betainy z alkoholem.
Produkty lecznicze zawierające betainę bardzo często powodują zwiększenie poziomu metioniny we krwi i mogą wpływać na wyniki badań diagnostycznych.
",https://www.doz.pl//leki/w129-Betaina,"betaina, betaina bezwodna","Wskazaniem do stosowania betainy jest leczenie uzupełniające homocystynurii,  genetycznego zaburzenia związanego z deficytem lub defektem enzymów biorących udział w metabolizmie homocysteiny w organizmie. Betaina obniża poziom homocysteiny w osoczu, zapobiegając poważnym skutkom ubocznym zagrażającym życiu. ","nawilżające, utrzymuje prawidłowy poziom homocysteiny"
Betaksolol,Betaxolol,"Substancja lecznicza nie wpływa na prowadzenie pojazdów i obsługę maszyn, należy jednak wziąć pod uwagę wystąpienie nadmiernego zmęczenia i zawrotów głowy podczas stosowania leku przez niektórych pacjentów. Należy ocenić reakcję pacjenta na leczenie przed podjęciem decyzji o prowadzeniu pojazdu.
Betaksolol może spowodować pojawienie się fałszywie dodatniego wyniku antydopingowego u sportowców.
",https://www.doz.pl//leki/w130-Betaksolol,"betaksolol, chlorowodorek betaksololu","Betaksolol należy do substancji blokujących receptory β–adrenergiczne.  Substancję czynną charakteryzuje kardioselektywność, betaksolol działa głównie na receptory β1. Lek znalazł zastosowanie w leczeniu schorzeń układu sercowo–naczyniowego takich jak:","chronotropowe ujemne (-) (zmniejszenie częstości pracy serca), dromotropowe ujemne (-) (zmniejsza szybkość przewodzenia impulsów), inotropowe ujemne (-) (zmniejsza siłę skurczu), przeciwnadciśnieniowe (hipotensyjne), przeciwjaskrowe (obniża ciśnienie w gałce ocznej)"
Betametazon,Betamethasone,"Alkohol zażywany przez pacjenta równolegle z przyjmowaniem betametazonu w iniekcji może zwiększyć częstość występowania lub nasilenie wrzodów przewodu pokarmowego.
Kortykosteroidy - w tym również betametazon, mogą wywierać wpływ na wynik testu z błękitem nitrotetrazolowym w zakażeniach bakteryjnych, dając wynik fałszywie ujemny.
",https://www.doz.pl//leki/w131-Betametazon,"betametazon, dipropionian betametazonu, sól sodowa fosforanu betametazonu, walerianian betametazonu",Betametazon występuje w różnych postaciach leku. W zależności od postaci ma różne wskazania.,"immunosupresyjne (zmniejsza odporność), przeciwalergiczne (łagodzi objawy alergii), przeciwzapalne"
Bewacyzumab,Bevacizumab,"Pacjenci leczeni bewacyzumabem muszą zachować szczególną ostrożność podczas prowadzenia pojazdów mechanicznych i obsługi maszyn, ponieważ stosowanie bewacyzumabu może powodować omdlenia i senność. Dodatkowo u niektórych pacjentów może dojść do upośledzenia koncentracji i wydłużenia czasu reakcji - w tej sytuacji należy powstrzymać się od prowadzenia pojazdów, do czasu ustąpienia objawów.
",https://www.doz.pl//leki/w132-Bewacyzumab,bewacyzumab,"Bewacyzumab jest stosowany w leczeniu skojarzonym z szeregiem innych środków przeciwnowotworowych, w  przypadkach raka okrężnicy i odbytnicy z przerzutami, piersi, jajnika i jajowodu oraz nawrotowego lub przerzutowego nowotworu szyjki macicy.","przeciwnowotworowe (cytostatyczne, cytotoksyczne)"
Bezylezomab,Besilesomab,"Substancja lecznicza nie wywiera wpływu na zdolność prowadzenia pojazdów lub obsługi maszyn.
Stosowanie antybiotyków w trakcie badania lub bezpośrednio przed zabiegiem nie jest zalecane ze względu na prawdopodobieństwo otrzymania fałszywie ujemnych wyników badania.
",https://www.doz.pl//leki/w133-Bezylezomab,bezylezomab,Bezylezomab jest przeciwciałem monoklonalnym IgG1.,diagnostyczne
Białko,ludzkie,"Białko ludzkie C nie powoduje objawów wpływających na zdolność prowadzenia pojazdów i obsługiwania maszyn.
",https://www.doz.pl//leki/w134-Bialko_ludzkie_C,białko ludzkie c,"Białko ludzkie C to glikoproteina o właściwościach przeciwzakrzepowych. Białko ludzkie C jest wskazane u pacjentów z ciężkim wrodzonym niedoborem substancji, w celu leczenia plamicy piorunującej i martwicy skórnej wywołanej kumaryną. Białko ludzkie C stosuje się również w leczeniu chorych z ciężkim wrodzonym niedoborem białka C, jeśli leczenie pochodną kumaryny jest niewystarczające, niemożliwe do przeprowadzenia lub dopiero rozpoczęto terapię pochodną kumaryny. Wskazaniem do zastosowania substancji jest także zagrażający życiu zabieg lub leczenie inwazyjne chorych z ciężkim wrodzonym niedoborem białka C.",przeciwzakrzepowe (antykoagulacyjne)
Bifonazol,Bifonazole,"Bifonazol nie wywiera wpływu na zdolność prowadzenia pojazdów i obsługi maszyn. 
",https://www.doz.pl//leki/w135-Bifonazol,bifonazol,"Bifonazol należy do pochodnych imidazolu wykazujących działanie przeciwgrzybicze. Substancja czynna znalazła zastosowanie w leczeniu schorzeń skóry wywołanych przez niektóre grzyby chorobotwórcze. Bifonazol jest skuteczny podczas terapii grzybiczych zakażeń skóry, fałdów skórnych,  rąk i stóp, łupieżu rumieniowatego oraz pstrego, a także miejscowej kandydozy. ",przeciwgrzybicze
Bikalutamid,Bicalutamide,"Bikalutamid wywiera nieznaczny wpływ na zdolność prowadzenia pojazdów oraz obsługę maszyn. Wśród objawów niepożądanych substancji może wystąpić senność, wówczas należy zachować ostrożność podczas wykonywania powyższych czynności. 
Bikalutamid może powodować reakcje nadwrażliwości na promieniowanie UV oraz światło słoneczne.
",https://www.doz.pl//leki/w136-Bikalutamid,bikalutamid,"Bikalutamid stosowany jest w leczeniu miejscowym pacjentów ze stadium zaawansowanym raka gruczołu krokowego o wysokim ryzyku postępowania choroby, w monoterapii oraz jako leczenie uzupełniające po radykalnej prostatektomii lub radioterapii. Bikalutamid wykorzystywany jest również w terapii pacjentów z miejscowo zaawansowanym rakiem gruczołu krokowego bez przerzutów, w sytuacji gdy kastracja (chirurgiczna lub farmakologiczna) oraz stosowanie innych leków nie jest właściwe lub akceptowane. ",przeciwandrogenne (antyandrogenowe) (hamuje działanie androgenów)
Biktegrawir,Bictegravir,"Badania wykazały niewielki wpływ pokarmu bogatego w tłuszcze na proces wchłaniania biktegrawiru. Nie jest to jednak efekt istotny klinicznie, stąd lek można zażywać niezależnie od posiłków. 
Bikterawir może powodować wzrost stężenia lipidów oraz glukozy we krwi.
",https://www.doz.pl//leki/w1300-Biktegrawir,biktegrawir,"Biktegrawir jest nowym lekiem należącym do grupy inhibitorów integrazy (INSTIs). Jest stosowany w terapii zakażenia HIV-1 (ludzki wirus upośledzenia odporności typu 1, human immunodeficiency virus) u pacjentów dorosłych. Warunkiem do stosowania bikterawiru jest brak stwierdzonej oporności na inne leki z tej grupy (inhibitorów integrazy). Biktegrawir jest skuteczny w przypadku supresji wirusologicznej RNA HIV-1 <50 c/ml. Lek stosuje się w połączeniu  z tenofowirem i emtrycytabiną w postaci tabletki doustnej. ",przeciwwirusowe
Bilastyna,Bilastine,"Pokarm obniża dostępność biologiczną Bilastyny o około 30%. Podobny efekt daje podanie soku grejfrutowego (możliwy jest również  po innych sokach owocowych).
Nie zaobserwowano interakcji Bilastyny z alkoholem.
Bilastyna nie jest metabolizowana i nie wpływa na aktywność izoenzymów cytochromu P450, dlatego też bardzo rzadko wchodzi w interakcje z innymi lekami czy suplementami. Bilastyna posiada wysoką selektywność wobec receptora histaminowego H1, a co za tym idzie profil farmakokinetyczny i farmakodynamiczny jest dosyć przewidywalny.
",https://www.doz.pl//leki/w137-Bilastyna,bilastyna,Bilastyna to substancja o działaniu przeciwhistaminowym (przeciwalergicznym) – łagodzi objawy alergii.,"przeciwalergiczne (łagodzi objawy alergii), przeciwhistaminowe (antagoniści receptora H1)"
Bimatoprost,Bimatoprost,"Bimatoprost nie wykazuje istotnego wpływu na zdolność prowadzenia pojazdów i obsługę maszyn. W przypadku pojawienia się zaburzeń wzroku po zastosowaniu preparatu zawierającego substancję czynną należy wstrzymać się z prowadzeniem pojazdu, aż proces widzenia wróci do normy.
",https://www.doz.pl//leki/w138-Bimatoprost,bimatoprost,"Bimatoprost występuje w składzie preparatów okulistycznych, jako pojedynczy składnik lub substancja towarzysząca β-blokerowi o działaniu miejscowym. Lek redukuje zwiększone ciśnienie wewnątrzgałkowe u osób dorosłych oraz w przypadku jaskry otwartego kąta przesączania o przewlekłym charakterze.",przeciwjaskrowe (obniża ciśnienie w gałce ocznej)
