Polska nazwa,Angielska nazwa,Interakcje,Strona,Substancja aktywna,Wskazania,Działanie
Doksazosyna,Doxazosin,"Spożywanie alkoholu podczas leczenia doksazosyną może nasilić jej działania niepożądane związane z zaburzeniem koordynacji i równowagi.
",https://www.doz.pl//leki/w303-Doksazosyna,"doksazosyna, metanosulfonian doksazosyny, mesylan doksazosyny",Doksazosyna wskazana jest w leczeniu objawów łagodnego rozrostu gruczołu krokowego oraz leczeniu pierwotnego (samoistnego) nadciśnienia tętniczego.,"łagodzi objawy przerostu prostaty (gruczołu krokowego), rozszerza naczynia krwionośne, przeciwnadciśnieniowe (hipotensyjne), obniża ciśnienie tętnicze krwi"
Doksepina,Doxepin,"Przy równoczesnym stosowaniu doksepiny i spożywaniu etanolu może dojść do nasilonej reakcji na alkohol oraz pojawienia się nadmiernego uspokojenia i senności u pacjenta. Donoszono również o śmiertelnych przypadkach w przypadku łączenia leku z alkoholem.
",https://www.doz.pl//leki/w304-Doksepina,doksepina,"Doksepina jest pochodną dibenzoksepiny, należącą do leków przeciwdepresyjnych o budowie trójpierścieniowej. Stosowana jest w stanach depresyjnych z lękiem i niepokojem w przebiegu różnego rodzaju psychoz m. in. w depresji inwolucyjnej oraz w fazie depresyjnej w przebiegu choroby afektywnej dwubiegunowej. Doksepinę stosuje się także w terapii depresji i stanów lękowych w przebiegu chorób somatycznych i chorób organicznych, w zespołach depresyjno-lękowych w przebiegu choroby alkoholowej oraz w zaburzeniach nerwicowych przebiegających z objawami depresji i lęków. ","przeciwdepresyjne (antydepresyjne, tymoleptyczne), przeciwlękowe (anksjolityczne), uspokajające"
Doksorubicyna,Doxorubicin,"Podczas terapii doksorubicyną należy unikać wyciągów z dziurawca. Zioło to indukuje metabolizm CYP3A4, co może zmniejszać stężenie doksorubicyny w surowicy. Grejpfrut natomiast hamuje metabolizm CYP3A4, co może zwiększać stężenie doksorubicyny w surowicy. Dlatego należy także unikać soków grejfrutowych i wyciągów go zawierających.
W czasie terapii doksorubicyną nie należy stosować wyciągów z  dziurawca Hypericum perforatum, gdyż może on obniżać stężenie doksorubicyny w osoczu krwi.
",https://www.doz.pl//leki/w305-Doksorubicyna,"doksorubicyna, doksorubicyny chlorowodorku",Doksorubicyna jest cytotoksycznym antybiotykiem antracyklinowym wyizolowanym z kultur Streptomyces peucetius var. caesius. Znalazła zastosowanie w terapii następujących stanów nowotworowych:,"przeciwnowotworowe (cytostatyczne, cytotoksyczne)"
Doksycyklina,Doxycycline,"Produkty nabiałowe takie jak mleko, sery, jogurty, kefir zmniejszają wchłanianie doksycykliny z przewodu pokarmowego, dlatego należy zachować co najmniej dwu godzinny odstęp pomiędzy przyjęciem laku a spożywaniem produktów nabiałowych
Alkohol osłabia efekt terapeutyczny doksycykliny, należy unikać jednoczesnego stosowania.
Stosowanie doksycykliny może zaburzać wyniki testów wykrywających stężeniae glukozy, białka urobilinogenu oraz katecholamin w moczu, 
",https://www.doz.pl//leki/w306-Doksycyklina,"doksycyklina, hyklan doksycykliny",Doksycyklinę stosuję się w leczeniu infekcji spowodowanych przez bakteria wrażliwe na działanie tej substancji.,"przeciwbakteryjne, przeciwmalaryczne (przeciwzimnicze)"
Doksylamina,Doxylamine,"W związku z tym, że dane dotyczące hamowania metabolizmu doksylaminy przez sok grejpfrutowy są ograniczone, nie zaleca się jego picia w czasie stosowania substancji czynnej.
Jednoczesne stosowanie doksylaminy i picie alkoholu jest przeciwwskazane. Alkohol wykazuje depresyjne działanie na ośrodkowy układ nerwowy (OUN). Doksylamina w połączeniu z alkoholem będzie zatem wykazywała addytywne działanie na OUN.
Doksylamina, jako lek należący do substancji przeciwhistamnowych, hamuje reakcje alergiczne. Zaleca się odstawienie leku na 3 dni przed planowanym testem skórnym (ryzyko wyników fałszywie ujemnych).
",https://www.doz.pl//leki/w307-Doksylamina,"doksylamina, doksylaminy wodorobursztynianu","Doksylamina to lek przeciwhistaminowy powszechnie stosowany jako środek nasenny i uspakajający. Na świecie substancja ta jest również stosowana w łagodzeniu objawów kataru siennego (alergicznego nieżytu nosa), pokrzywki (wysypka lub swędzenie) i innych reakcji alergicznych. Doksylamina jest również silnym środkiem antycholinergicznym. W Polsce substancja czynna wskazana jest przede wszystkim w krótkotrwałym leczeniu bezsenności (częste przebudzenia w godzinach porannych lub nocnych).","nasenne, uspokajające, przeciwhistaminowe (antagoniści receptora H1), Leki przeciwwymiotne"
Dokuzynian,sodu,"Nie przeprowadzono badań dotyczących wpływu dokuzynianu sodu na zdolność prowadzenia pojazdów i obsługę maszyn.
",https://www.doz.pl//leki/w308-Dokuzynian_sodu,"dokuzan sodowy, dokuzynian sodu","Dokuzynian sodu jest związkiem powierzchniowo czynnym, który zmienia konsystencję mas kałowych i ułatwia ich wypróżnianie. Lek wskazany jest w zapobieganiu i leczeniu przewlekłych zaparć. Podawany jest również u pacjentów z guzkami krwawniczymi lub szczelinami odbytu, a także u osób, u których ze względu na stan zdrowia nie jest wskazany nadmierny wysiłek przy oddawaniu stolca. Dokuzynian sodu stosowany jest również u pacjentów przed operacjami i zabiegami diagnostycznymi.",przeczyszczające
Dolutegrawir,Dolutegravir,"Zaobserwowano wzrost ryzyka wystąpienia martwicy kości u pacjentów stosujących terapię antyretrowirusową i spożywających alkohol.
Preparaty dziurawca mogą zmniejszać stężenie dolutegrawiru w osoczu. W szczególności u pacjentów z opornością na inhibitory integrazy należy rozważyć zastosowanie innych leków o podobnym działaniu do wyciągów z dziurawca.
",https://www.doz.pl//leki/w309-Dolutegrawir,dolutegrawir,"Dolutegrawir jest lekiem przeciwwirusowym należącym do grupy inhibitorów integrazy. Lek stosowany jest w skojarzeniu z innymi lekami antyretrowirusowymi w terapii zakażeń ludzkim wirusem upośledzenia odporności (HIV) u osób dorosłych, młodzieży oraz dzieci od 6 r.ż. i masie minimalnej 14 kg.",przeciwwirusowe
Domperidon,Domperidone,"Domperidon należy przyjmować 15-30min przed posiłkiem, ze względu na lepsze wchłanianie leku. 
Alkohol osłabia metabolizm domperidonu, dlatego nie należy go spożywać podczas terapii domperidonem. 
",https://www.doz.pl//leki/w310-Domperidon,domperidon,"Domperidon znajduje zastosowanie w leczeniu nudności, wymiotów, uczucia pełności oraz bóli w nadbrzuszu, a także refluksu żołądkowego. ","prokinetyczne (zwiększa perystaltykę/motorykę jelit), przeciwwymiotne"
Donepezil,Donepezil,"Spożywanie alkoholu podczas leczenia donepezilem jest przeciwwskazane, ze względu na zmniejszenie stężenia substancji czynnej, a co za tym idzie zmniejszenie działania leku.
Jednoczesne stosowanie donepezilu oraz preparatów, które zwierają w swoim składzie wyciąg z dziurawca Hypericum perforatum może powodować osłabienie działania substancji macierzystej.
",https://www.doz.pl//leki/w311-Donepezil,"chlorowodorku donepezilu, donepezil",Wskazaniami do stosowania donepezilu jest łagodna oraz średnio ciężka postać otępienia przebiegająca w chorobie Alzheimera.,poprawa procesów poznawczych
Dopamina,Dopamine,"Jako że dopamina jest stosowana w stanach zagrożeniach życia nie zaobserwowano wpływu na prowadzenie pojazdów lub obsługę maszyn.
U chorych na chorobę Parkinsona leczonych agonistami dopaminy po podaniu dopaminy zaobserwowano skłonność do gier hazardowych, wzrost libido.
",https://www.doz.pl//leki/w312-Dopamina,dopamina chlorowodorek,"Dopamina jest stosowana w leczeniu zaburzeń krążenia wywołanych wstrząsem po zawale mięśnia sercowego, posocznicy, urazach, operacjach kardiochirurgicznych, zaostrzeniach przewlekłej zastoinowej niewydolności serca a także we wstrząsie prowadzącym do niewydolności nerek.","inotropowe dodatnie (+) (zwiększa siłę skurczu), moczopędne (diuretyczne) (zwiększa objętość wydalanego moczu), podwyższa ciśnienie krwi"
Dornaza,alfa,"W wyniku stosowania dornazy alfa może dochodzić do pogorszenia wyników testów, które oceniają czynność płuc.
",https://www.doz.pl//leki/w313-Dornaza_alfa,dornaza alfa,"Dornaza alfa to enzym proteolityczny, obecnie produkowany jako rekombinat DNA. Substancja czynna jest stosowana w leczeniu mukowiscydozy. Wykazuje silne właściwości upłynniające wydzielinę ropną. Wykorzystywana jest w celu poprawy czynności płuc pacjenta.",mukolityczne (zmniejsza lepkość śluzu)
Dorzolamid,Dorzolamide,"Po zastosowaniu miejscowo kropli do oczu zawierających dorzolamid może nastąpić nieostrość widzenia czy zawroty głowy. Do momentu ustania tych objawów po aplikacji leku nie należy prowadzić pojazdów oraz obsługiwać maszyn. 
",https://www.doz.pl//leki/w314-Dorzolamid,dorzolamid,"Dorzolamid jest lekiem obniżającym ciśnienie wewnątrzgałkowe, dlatego stosowany jest u chorych z nadciśnieniem w gałce ocznej. Ponadto, dorzolamid znalazł zastosowanie w leczeniu jaskry z otwartym kątem przesączania, jaskrą torebkową oraz jaskrą wtórną z zespołem pseudoeksfoliacji. ",przeciwjaskrowe (obniża ciśnienie w gałce ocznej)
Dronedaron,Dronedarone,"Grejpfruty i napoje z nich pozyskiwane podnoszą stężenie dronedaronu, zwiększając ryzyko wystąpienia działań niepożądanych. Substancję leczniczą i owoc można przyjąć zachowując co najmniej 4 godziny przerwy.
Dziurawiec zwyczajny zmniejsza stężenie dronaderonu we krwi, nie wpływając na stężenie czynnego metabolitu. Należy unikać łącznego ich przyjmowania.
",https://www.doz.pl//leki/w315-Dronedaron,dronedaron,"Dronedaron wspiera zachowanie stabilnego rytmu zatokowego, po skutecznie przeprowadzonej kardiowersji u pacjentów cierpiących na napadowe albo przetrwałe migotanie przedsionków.",przeciwarytmiczne
Droperydol,Droperidol,"Jednoczesne stosowanie droperydolu z alkoholem zwiększa ryzyko wystąpienia groźnych zaburzeń rytmu serca.
",https://www.doz.pl//leki/w316-Droperydol,droperydol,"Droperydol jest stosowany wyłącznie w lecznictwie szpitalnym. Ze względu na swoje silne działanie przeciwwymiotne znajduje zastosowanie w zapobieganiu i leczeniu nudności oraz wymiotów pooperacyjnych u pacjentów dorosłych, oraz u dzieci i młodzieży gdzie jest stosowany jako lek drugiego rzutu. Jest również wykorzystywany w zapobieganiu nudnościom i wymiotom mogącym wystąpić podczas stosowaniu pochodnych morfiny w pooperacyjnym leczeniu bólu.","przeciwpsychotyczne (neuroleptyczne) (leczenie schozofrenii i psychoz), przeciwwymiotne, obniża ciśnienie tętnicze krwi, Leki przeciwwymiotne"
Drospirenon,Drospirenone,"Przyjmowanie drospirenonu wraz z posiłkiem nie wpływa na jego wchłanianie, jednak sok grejpfrutowy może zwiększać stężenie drospirenonu w osoczu.
Stosowanie drospirenonu z substancjami indukującymi pracę enzymów  cytochromu P450 może doprowadzić do zwiększonego klirensu hormonów płciowych a przez to skutecznie obniżyć działanie antykoncepcyjne i wywołać krwawienie międzymiesiączkowe. Indukcję enzymatyczną obserwuje się już zwykle po kilku dniach jego przyjmowania, natomiast maksimum jest zauważalne po kilku tygodniach i może trwać nawet do czterech tygodni od zaprzestania przyjmowania drospirenonu. Kobiety, którym włączono do leczenia substancje mogące indukować pracę enzymów powinny stosować dodatkowe zabezpieczenie antykoncepcyjne w trakcie ich używania oraz przez kilka tygodni po zakończonej nimi kuracji.
",https://www.doz.pl//leki/w317-Drospirenon,drospirenon,"Wskazaniem do stosowania drospierenonu jest doustna antykoncepcja oraz  hormonalna terapia zastępcza (HTZ), gdzie jest jednym ze składników produktów złożonych.","antykoncepcyjne, progestagenne"
Drotaweryna,Drotaverine,"Drotawerynę można przyjmować z posiłkiem lub niezależnie od posiłków.
",https://www.doz.pl//leki/w1393-Drotaweryna,chlorowodorek drotaweryny,Drotaweryna jest pochodną papaweryny o działaniu rozkurczającym mięśnie gładkie. Działa na wszystkie rodzaje mięśni bez względu na to gdzie one są umiejscowione.,spazmolityczne (rozkurcza i zmniejsza napięcie mięśni gładkich)
Dulaglutyd,Dulaglutide,"Ze względu na specyfikę schorzenia, w którym stosuje się dulaglutyd zalecana jest dieta o niskim indeksie glikemicznym.
",https://www.doz.pl//leki/w319-Dulaglutyd,dulaglutyd,"Wskazaniem do stosowania dulaglutydu jest cukrzyca typu 2, w której nie da się osiągnąć kontroli glikemii za pomocą wysiłku fizycznego i diety lub przy nietolerancji metforminy. Dulaglutyd jest stosowany w monoterapii lub leczeniu skojarzonym.",przeciwcukrzycowe (hipoglikemizujące; zmniejsza stężenie glukozy we krwi)
Duloksetyna,Duloxetine,"Przyjmowanie leku z pokarmem może opóźnić wystąpienie maksymalnego stężenie we krwi o trzy godziny. Maksymalne stężenie osiągane przez duloksetynę w osoczu zmniejsza się o 10% zakładanej wartości w przypadku przyjęcia leku z posiłkiem.
Podczas terapii z wykorzystaniem duloksetyny nie należy jednocześnie spożywać alkoholu. Przyjmowanie dużych ilości alkoholu w trakcie leczenia duloksetyną niesie ze sobą wzrost ryzyka uszkodzenia wątroby.
Duloksetyna może wywołać wystąpienie zjawiska fotowrażliwości. Ze względu na możliwość wystąpienia reakcji fotouczulającej należy chronić skórę przed ostrym i bezpośrednim światłem słonecznym oraz zrezygnować z korzystania z solarium.
",https://www.doz.pl//leki/w320-Duloksetyna,"duloksetyna, chlorowodorek duloksetyny","Duloksetyna została zarejestrowana w leczeniu zaburzeń psychicznych, do których należy między innymi depresja. Jest ona także stosowana w celu łagodzenia ciężkich epizodów depresyjnych oraz zaburzeń lękowych o charakterze uogólnionym.","przeciwdepresyjne (antydepresyjne, tymoleptyczne), przeciwlękowe (anksjolityczne), wspomaga leczenie przewlekłego bólu"
Dupilumab,Dupilumab,"Brak danych na temat interakcji dupilumabu z pożywieniem. 
Brak danych na temat interakcji dupilumabu z alkoholem. 
",https://www.doz.pl//leki/w1307-Dupilumab,dupilumab,"Dupilumab jest stosowany w terapii atopowego zapalenie skóry u dorosłych i dzieci od 12 roku życia, kwalifikującego się do leczenia ogólnego.",przeciwzapalne
Dutasteryd,Dutasteride,"Przyjmowanie dutasterydu wraz z posiłkiem nie wpływa na osiągane stężenie substancji we krwi.
",https://www.doz.pl//leki/w321-Dutasteryd,dutasteryd,Dutasteryd wstosowany jest w leczeniu umiarkowanych do ciężkich objawów łagodnego rozrostu gruczołu krokowego oraz w celu zmniejszenia ryzyka ostrego zatrzymania moczu i konieczności leczenia zabiegowego.,łagodzi objawy przerostu prostaty (gruczołu krokowego)
Dydrogesteron,Dydrogesterone,"Łączenie alkoholu z lekami może powodować nasilenie działania skutków ubocznych. W przypadku dydrogestegonu nie ma jednoznacznych interakcji substancji czynnej z alkoholem, jednakże należy zwrócić uwagę na przyczynę przyjmowania pochodnej progesteronu. Stosowanie dydrogestegonu w okresie ciąży, całkowicie zabrania przyjmowania alkoholu, ze względu na zwiększone m.in. ryzyko poronienia oraz alkoholowego zespołu płodowego.  
Wszelkie produkty ziołowe zawierające w swoim składzie ziele dziurawca zwyczajnego tj. Hypericum perforatum, a także preparaty z szałwią, korzeniem kozłka lekarskiego (Valeriana ofiicinalis),  miłorzębem dwuklapowym (Ginkgo Biloba) stosowane równocześnie z dydrogesteronem mogą powodować zwiększenie metabolizmu podanej substancji czynnej, co skutkuje zmniejszeniem działania podanego preparatu. 
",https://www.doz.pl//leki/w322-Dydrogesteron,dydrogesteron,1. Dydrogesteron stosowany jest głównie w niedoborach progesteronu. ,"antykoncepcyjne, uzupełnia niedobór progesteronu"
Edoksaban,Edoxaban,"Niektóre składniki pokarmowe oraz preparaty ziołowe mogą wpływać na farmakokinetykę edoksabanu, a przez to osłabiać lub nasilać jego działanie przeciwzakrzepowe. Zaliczamy do nich miedzy innymi: miłorząb japoński (Ginkgo biloba), berberynę, pieprz czarny, sok grejpfrutowy, apigeninę, rutynę, kapsaicynę, ekstrakt z soi, notoginsenozyd R1 (pochodzący z Żeń-Szenia fałszywego), kurkuminę, zieloną herbatę, honokiolu, dziurawiec, kwercetynę, korzeń tarczownicy bajkalskiej, mleko sojowe, sukralozę, lukrecję (i produkty nią słodzone), genipinę, mango. Należy również unikać składników, które wykazują działanie antykoagulacyjne jak na przykład: czosnek, imbir, danshen oraz borówka czarna.
Alkohol może nasilać działanie leku i prowadzić do intensywnych krwawień.
Ziele dziurawca (Hypericum perforatum)  zmniejsza stężenie edoksabanu w osoczu krwi.
",https://www.doz.pl//leki/w323-Edoksaban,edoksaban,"Edoksaban jest stosowany w profilaktyce udarów mózgu i zatorowości systemowej u dorosłych pacjentów z niezastawkowym migotaniem przedsionków, u których występuje co najmniej jeden następujących czynników ryzyka: zastoinowa niewydolność serca, nadciśnienie tętnicze, wiek ≥ 75 lat, cukrzyca, przebyty udar mózgu, przemijający napad niedokrwienny.",przeciwzakrzepowe (antykoagulacyjne)
Edotreotyd,Edotreotide,"Zarówno przed podaniem edotreotydu jak i po zabiegu, pacjenci powinni wypijać dużą ilość płynów aby szybko wyeliminować lek z organizmu.
",https://www.doz.pl//leki/w324-Edotreotyd,edotreotyd,"Edotreotyd jest czynnikiem diagnostycznym stosowanym w celu wykrycia lokalizacji guzów i przerzutów. Lek znakowany za pomocą roztworu chlorku galu (68Ga) jest wykorzystywany w badaniu PET (pozytonowa tomografia emisyjna). Badanie diagnostyczne jest nieinwazyjne i opiera się na emisji pozytonów przez cząsteczki podanego środka diagnostycznego, który gromadzi się w tkankach aktywnych metabolicznie (tkanki nowotworowe, w tym guzy neuroendokrynne z dodatnim receptorem somastatynowym).",diagnostyczne
Efawirenz,Efavirenz,"Przyjmowanie efawirenzu z posiłkiem może powodować zwiększenie narażenia na substancję, co z kolei może być przyczyną występowania działań niepożądanych. Z tego powodu efawirenz powinien być przyjmowany na czczo, najlepiej przed snem. Nie wolno go stosować z sokiem grapefruitowym, który obniża aktywność enzymów metabolizujących efawirenz.
Zwiększenie stężenia efawirenzu we krwi możemy obserwować gdy jest popijany sokiem grapefruitowym, takie połączenie nie jest zalecane.
",https://www.doz.pl//leki/w325-Efawirenz,efawirenz,"Efawirenz jest stosowany do leczenia skojarzonego zakażeń ludzkim wirusem upośledzenia odporności-1 (HIV-1). Wskazany jest dla dzieci w wieku od trzech miesięcy (gdy ich waga przekracza 3,5 kg) oraz młodzieży i dorosłych.",przeciwwirusowe
Efedryna,Ephedrine,"Efedryna nie zaburza zdolności prowadzenia pojazdów i obsługiwania maszyn. Jednakże przyjęta w dawkach większych niż zalecane, może wywołać nadmierną pobudliwość nerwową, co może mieć niekorzystny wpływ na bezpieczeństwo prowadzenia pojazdów i obsługiwania maszyn.
Efedryna może dawać pozytywne wyniki testów antydopingowych u sportowców.
",https://www.doz.pl//leki/w1308-Efedryna,"Efedryna jest nieselektywnym lekiem sympatykomimetycznym. W lecznictwie wykorzystuje się ją ze względu na działanie rozkurczające oskrzela, udrażniające drogi oddechowe oraz podnoszące ciśnienie. ","chronotropowe dodatnie (+) (zwiększenie częstości pracy serca), inotropowe dodatnie (+) (zwiększa siłę skurczu), rozszerza oskrzela (rozkurcza mięśnie gładkie oskrzeli), wspomaga leczenie kataru (nieżytu nosa), sympatykomimetyczne (pobudza czynność układu współczulnego), zwężające naczynia krwionośne"
Ekonazol,Econazole,"Substancja nie ma wpływu na prowadzenie pojazdów i obsługę maszyn.
",https://www.doz.pl//leki/w329-Ekonazol,"azotan ekonazolu, ekonazol","Ekonazol stosuje się miejscowo do leczenia grzybicy stóp i rąk, grzybicy podudzia, grzybicy tułowia, grzybicy owłosionej skóry głowy, w drożdżycy rąk i paznokci, grzybicznego zapalenia ucha wewnętrznego. Wskazaniem do stosowania są także łupież pstry, zakażenia grzybicze sromu, pochwy i żołędzi oraz zakażenia powikłane bakteriami Gram-dodatnimi. ",przeciwgrzybicze
Eksemestan,Exemestane,"Nie potwierdzono interakcji z pożywieniem, jednak wykazano, ze stosowanie eksemestanu z pożywieniem zwiększa dostępność biologiczną leku o 40%.
Brakuje danych na temat interakcji eksemestanu z alkoholem, nie zaleca się jednak spożywania napojów alkoholowych podczas terapii.
Ziele dziurawca (Hypericum perforatum) może zmniejszać skuteczność eksemestanu.
",https://www.doz.pl//leki/w330-Eksemestan,eksemestan,"Eksemestan jest stosowany jako uzupełnienie terapii u pacjentek po menopauzie z inwazyjnym wczesnym rakiem piersi po około 2-3 latach stosowania leczenia uzupełniającego tamoksifenem oraz w leczeniu zaawansowanego raka piersi u pacjentek po menopauzie (wywołanej leczeniem lub naturalnej), u których choroba rozwinęła się po zastosowaniu terapii przeciwestrogenowej. Warunkiem koniecznym skuteczności eksemestanu u kobiet jest obecność receptorów estrogenowych w tkance guza.","przeciwnowotworowe (cytostatyczne, cytotoksyczne)"
Eksenatyd,Exenatide,"Eksenatydu nie należy stosować w okresie ciąży ze względu na brak wystarczających danych dotyczących bezpieczeństwa takiej terapii.
",https://www.doz.pl//leki/w331-Eksenatyd,eksenatyd,"Eksenatyd zwiększa wytwarzanie insuliny, prowadząc do obniżenia stężenia cukru we krwi. ",przeciwcukrzycowe (hipoglikemizujące; zmniejsza stężenie glukozy we krwi)
Ekulizumab,Eculizumab,"Ekulizumab nie wpływa na zdolność do prowadzenia pojazdów mechanicznych. 
",https://www.doz.pl//leki/w332-Ekulizumab,ekulizumab,"Ekulizumab znajduje zastosowanie w leczeniu bardzo rzadkich schorzeń u dorosłych i dzieci, takich jak napadowa nocna hemoglobinuria, atypowy zespół hemolityczno–mocznicowy oraz wyłącznie u dorosłych pacjentów z przeciwciałami przeciwko receptorowi acetylocholinowemu w przypadku opornej na leczenie uogólnionej miastenii rzekomoporaźnej.",uzupełnienie niedoboru przeciwciał
Elbaswir,Elbasvir,"W trakcie terapii elbaswirem nie należy spożywać grejpfrutów oraz soku grejpfrutowego. Owoc ten zawiera związki hamujące aktywność izoenzymów CYP3A, co może prowadzić do wzrostu stężenia leku w osoczu oraz zwiększenia ryzyka działań niepożądanych.
Brak danych na temat interakcji elbaswiru z alkoholem.
W trakcie terapii elbaswirem nie powinno stosować się ziela dziurawca. Związki zawarte w tej roślinie pełnią rolę induktora izoenzymów CYP3A, nasilaja metabolizm substancji oraz  ostatecznie zmniejszają jej stężenie w osoczu. Może to skutkować brakiem efektów leczenia. 
",https://www.doz.pl//leki/w333-Elbaswir,elbaswir,Elbaswir w połączeniu z grazoprewirem jest wskazany w leczeniu przewlekłego wirusowego zapalenia wątroby typu C (genotypy HCV 1 oraz 4) w skojarzeniu z ribawiryną lub bez.,przeciwwirusowe
Eletryptan,Eletriptan,"Posiłek bogatotłuszczowy może zwiększyć wartość stężenia maksymalnego leku o 20-30%.
Połączenie eletryptanu z preparatami z dziurawca może nasilać działania niepożądane leku.
",https://www.doz.pl//leki/w334-Eletryptan,eletryptan,Eletryptan jest stosowany w celu przerwania ostrego napadu migreny (z aurą lub bez aury). Leku nie należy stosować w celu zapobiegania napadom migrenowym.,przeciwmigrenowe
Eliglustat,Eliglustat,"Podczas leczenia eliglustatem należy zrezygnować ze spożywania grejpfrutów oraz picia soku grejpfrutowego. Grejpfrut hamuje przemiany metaboliczne eliglustatu, które częściowo zachodzą przy udziale CYP3A4.
Alkohol spowalnia przemiany metaboliczne eliglustatu i może nasilać działania niepożądane leku.
Medyczna marihuana spowalnia metabolizm eliglustatu.
",https://www.doz.pl//leki/w335-Eliglustat,eliglustat,"Eliglustat jest stosowany w terapii osób dorosłych cierpiących na chorobę Gauchera typu 1 z intensywnym (EM), pośrednim (IM) i słabym metabolizmem (PM) CYP2D6. Lek jest inhibitorem syntazy glukozyloceramidu. ",hamujące enzym syntazę glukozyloceramidu
Elotuzumab,Elotuzumab,"Substancja czynna nie powoduje objawów wpływających na zdolność prowadzenia pojazdów i obsługiwania maszyn. Jeśli jednak u pacjenta wystąpią reakcje związane z podaniem wlewu, wówczas należy poinformować chorego, aby zachował ostrożność w czasie wykonywania tych czynności. 
W związku z tym, że elotuzumab może być wykrywany w czasie oznaczania białek surowicy metodą elektroforezy i immunofiksacji, może fałszować wyniki dotyczące etapu choroby u pacjentów z białkiem szpiczakowym klasy IgG typu kappa.
",https://www.doz.pl//leki/w337-Elotuzumab,elotuzumab,"Elotuzumab jest humanizowanym przeciwciałem monoklonalnym IgG wskazanym w połączeniu z deksametazonem oraz lenalidomidem lub pomalidomidem, w celu leczenia pacjentów ze szpiczakiem mnogim.","przeciwnowotworowe (cytostatyczne, cytotoksyczne)"
Eltrombopag,Eltrombopag,"Równoczesne podawanie eltrombopagu z pokarmem bogatym w wapń (produkty mleczne) zmniejsza wchłanianie tego leku.
",https://www.doz.pl//leki/w338-Eltrombopag,eltrombopag,"Eltrombopag wskazany jest u dzieci od 1 roku życia i dorosłych w leczeniu przewlekłej pierwotnej małopłytkowości immunologicznej (ITP ang. immune idiopathic thrombocytopenic purpura), u ktorych nie ma wystarczających efektów leczenia innymi metodami. ",przeciwkrwotoczne
